{
  "$schema": "https://json-schema.org/draft/2020-12/schema",
  "$id": "https://github.com/tm1944/hypothesis-globe/packages/schema/link.schema.json",
  "title": "EventLink",
  "description": "LLM hypothesis edge. Mirrors the TigerData mart.event_link table (the source of truth). Never present a link as a verified cause.",
  "type": "object",
  "additionalProperties": false,
  "required": [
    "id",
    "sourceId",
    "targetId",
    "relation",
    "confidence",
    "rationale",
    "citations",
    "model"
  ],
  "properties": {
    "id": { "type": "string", "description": "link_id" },
    "sourceId": { "type": "string", "description": "source_id" },
    "targetId": { "type": "string", "description": "target_id" },
    "relation": {
      "type": "string",
      "description": "Written by jobs/llm/link_events.py, e.g. same-event, shares-context, affects-market, primary-story, mentions, analyzes"
    },
    "confidence": { "type": "number", "minimum": 0, "maximum": 1 },
    "rationale": { "type": "string", "description": "rationale; empty when null" },
    "citations": {
      "type": ["array", "object"],
      "description": "citations jsonb: news↔news links store {plausibility, evidence, verdict, world_knowledge}; others store []"
    },
    "model": { "type": "string", "description": "model; empty when null" }
  }
}
